0,1,2,3,4,5
Is Disney a good stock?,"Disney stock has slid, demand-wise in the past few years, but its conservatively-run business model and steady earnings make it a favorite of value investors who know a stable company when they see one.",,Pros and Cons to Buying Walt Disney Co (DIS) Stock | Stock Market ...,money.usnews.com › stock-market-news › articles › walt-...,Search for: Is Disney a good stock?
Is Disney a buy or sell?,"Disney shares are a buy if they fall to this level, technical analyst says. ... Atlantic Equities also cut earnings estimates but upgraded the stock to overweight after its sharp sell-off.Apr 3, 2020",,"Disney shares are a buy if they fall to this level, technical analyst says",www.cnbc.com › 2020/04/03 › disney-shares-are-a-buy-i...,Search for: Is Disney a buy or sell?
Why is Disney stock dropping?,"Shares of Walt Disney Co. DIS, +4.85% are down 3.1 % in Monday trading after UBS analyst John Hodulik downgraded the stock to neutral from buy, writing that the company is in ""the eye of the storm"" amid the COVID-19 pandemic.Apr 20, 2020",,Disney stock falls after UBS downgrade - MarketWatch,www.marketwatch.com › story › disney-stock-falls-after-...,Search for: Why is Disney stock dropping?
What will Disney stock be worth in 10 years?,"Its current stock price is hovering around $130 a share. And if you invested in the company 10 years ago, you would have made a profit: A $1,000 investment on April 15, 2009, would be worth more than $7,600 as of April 15, 2019, a total return over 660%, according to CNBC calculations.Apr 16, 2019",,"What a $1,000 investment in Disney 10 years ago would be worth now",www.cnbc.com › 2019/04/15 › what-a-1000-dollar-invest...,Search for: What will Disney stock be worth in 10 years?
Is Disney stock a buy today?,,,,,
Does Disney pay dividends?,,,,,
Is it good time to buy Disney stock?,,,,,
Is Disney stock overpriced?,,,,,
Why is Tesla's stock so high?,,,,,
Is Disney stock a buy?,,,,,
What stock is best to invest in right now?,,,,,
Which stocks took the biggest hit today?,,,,,
Are there any benefits to owning Disney stock?,,,,,
,,,,,
,,,,,
