0,1,2,3,4,5
Is Tesla good stock to buy?,"Tesla stock has spent about 30% of the time over the past decade trading above the average analyst price target. ... Buying in May 2019 was a good idea too: Tesla shares are up about 130% from their 52-week low. The S&P 500 is down about 14% over the same span.Mar 20, 2020",,This Might Be the Best Time to Buy Tesla Stock Ever - Barron's,www.barrons.com › articles › this-might-be-the-best-time-...,Search for: Is Tesla good stock to buy?
Why is Tesla stock dropping?,"Shares of Tesla dropped as much as 12% Friday before closing down 10.3% after CEO Elon Musk tweeted that the company's shares are priced “too high.” The company just days before reported a strong quarter, sending shares higher.May 1, 2020",,"Tesla CEO Elon Musk says stock price is 'too high,' shares fall",www.cnbc.com › 2020/05/01 › tesla-ceo-elon-musk-says-...,Search for: Why is Tesla stock dropping?
Is Tesla stock a buy now?,"Tesla is looking like a good deal to Jefferies. The firm on Monday upgraded shares of the automaker to ""buy"" from ""hold"" while lowering its price target to $650 from $800. That implies a 35% upside from where shares closed at $480 per share on Friday.Apr 6, 2020",,"Jefferies says now is the time to buy Tesla, which it says could surge ...",markets.businessinsider.com › news › stocks › tesla-stock-...,Search for: Is Tesla stock a buy now?
Why is Tesla's stock so high?,"Tesla shares, which had closed Thursday at $781.88, an 82% gain for the year, were down more than 9% in midday trading Friday after the Twitter messages. ... Musk's ambitious growth plans for the electric car maker has sent shares soaring this year even amid fears of a prolonged recession from the coronavirus pandemic.May 1, 2020",,Elon Musk Tweeted That Tesla's Stock Was Too High. The Market ...,www.wsj.com › articles › tesla-stock-falls-after-ceo-tweets...,Search for: Why is Tesla's stock so high?
Is Tesla overvalued?,,,,,
What will Tesla stock be worth in 5 years?,,,,,
Is Tesla stock going to keep dropping?,,,,,
Will Tesla hit 1000?,,,,,
Is Tesla stock a buy?,,,,,
Is Tesla stock expected to rise?,,,,,
Will Tesla pay dividends?,,,,,
Is Tesla a good stock to buy 2020?,,,,,
Is Tesla going to fail?,,,,,
Is Tesla stock a bubble?,,,,,
,,,,,
